<?xml version="1.0" encoding="UTF-8"?>
<p:data xmlns:p="urn:x-gsip:1.0" xmlns:xsi="http://www.w3.org/2001/XMLSchema-instance" xsi:schemaLocation="urn:x-gsip:1.0 file:///C:/java64_8/gsip/WebContent/schemas/data.xsd">
	<!--  each elements are parsed into p1 to p{n}.  p0 = "data/x/y/z.." -->
	<p:match pattern="gwmon/WML2/historical/GIN/.*">
		<p:mime-type>text/plain</p:mime-type>
		<!--  can have more -->
		<p:source>http://gin.gw-info.net/service/gin/highcharts/data/en/0db46343-1c4f-aefc-1227-a6a90d49d53c/${p5}.zip?datasource=</p:source>
	</p:match>
	
	<p:match pattern="gwmon/WML2/historical/GIN/.*">
		<p:mime-type>text/xml</p:mime-type>
		<!--  can have more -->
		<p:source>http://gin.gw-info.net/GinService/sos/gw?REQUEST=GetFeatureOfInterest&amp;VERSION=2.0.0&amp;SERVICE=SOS&amp;featureOfInterest=${p5}</p:source>
	</p:match>
	
	
	<p:match pattern="gwmon/WML2/historical/GIN/.*">
		<p:mime-type>application/vnd.geo+json</p:mime-type>
		<!--  can have more -->
		<p:source proxy="true">http://gin.gw-info.net/service/ngwds/en/data/geojson/monitoring/${p5}</p:source>
	</p:match>
	
		<p:match pattern="gwmon/WML2/historical/GIN/.*">
		<p:mime-type>text/html</p:mime-type>
		<!--  can have more -->
		<p:source>http://gin.gw-info.net/service/gin/sos2/timeseries/natres?ID=${p5}</p:source>
	</p:match>
	
</p:data>
